{"schema_version":1,"source":"web","state":"playing","type":"episode","title":"Episode 12","artists":["Some Publisher"],"artist":"Some Publisher","album":"Some Show","album_artist":null,"track_number":null,"disc_number":null,"duration_ms":3725000,"position_ms":3600000,"uri":"spotify:episode:512ojhOuo1ktJprKbVcKyQ","url":"https://open.spotify.com/episode/512ojhOuo1ktJprKbVcKyQ","artwork_url":"https://i.scdn.co/image/ab67616d0000b273a9ab54d90005cfd439f821e8","isrc":null,"explicit":null,"device":null,"fetched_at":"2026-10-27T17:40:00Z"}
