{"schema_version":1,"source":"web","state":"playing","type":"episode","title":"Episode 42","artists":["The Publisher"],"artist":"The Publisher","album":"The Show","album_artist":null,"track_number":null,"disc_number":null,"duration_ms":3725000,"position_ms":1800000,"uri":"spotify:episode:512ojhOuo1ktJprKbVcKyQ","url":"https://open.spotify.com/episode/512ojhOuo1ktJprKbVcKyQ","artwork_url":"https://i.scdn.co/image/ab6765630000f68d1c2d3e4f5a6b7c8d9e0f1a2b","isrc":null,"explicit":true,"device":{"name":"Pixel 9","type":"Smartphone","volume_percent":30},"fetched_at":"2026-10-27T17:40:00Z"}
