{"schema_version":1,"source":"web","state":"playing","type":"track","title":"Amazone","artists":["Alvan","Tyler, The Creator"],"artist":"Alvan, Tyler, The Creator","album":"Home","album_artist":"Alvan, Ahmed","track_number":4,"disc_number":1,"duration_ms":238341,"position_ms":120165,"uri":"spotify:track:4brK3gpPjXArNUlU1hBXTe","url":"https://open.spotify.com/track/4brK3gpPjXArNUlU1hBXTe","artwork_url":"https://i.scdn.co/image/ab67616d0000b273a9ab54d90005cfd439f821e8","isrc":"FRZ111800001","explicit":false,"device":{"name":"Living Room","type":"Speaker","volume_percent":55},"fetched_at":"2026-10-27T17:40:00Z"}
