{"schema_version":1,"source":"web","state":"playing","type":"track","title":"Single","artists":["Alvan"],"artist":"Alvan","album":"Single","album_artist":"Alvan","track_number":1,"disc_number":1,"duration_ms":200000,"position_ms":60000,"uri":"spotify:track:0SingleTrackId00000001","url":"https://open.spotify.com/track/0SingleTrackId00000001","artwork_url":"https://i.scdn.co/image/ab67616d0000b2730000000000000000000000aa","isrc":"FRZ111800002","explicit":false,"device":{"name":"Living Room","type":"Speaker","volume_percent":55},"fetched_at":"2026-10-27T17:40:00Z"}
