{"schema_version":1,"source":"web","state":"playing","type":"track","title":"Amazone","artists":["Alvan"],"artist":"Alvan","album":"Home","album_artist":"Alvan","track_number":4,"disc_number":1,"duration_ms":238341,"position_ms":1000,"uri":"spotify:track:4brK3gpPjXArNUlU1hBXTe","url":"https://open.spotify.com/track/4brK3gpPjXArNUlU1hBXTe","artwork_url":"https://i.scdn.co/image/ab67616d0000b2730000000000000000000000cc","isrc":null,"explicit":false,"device":{"name":"Pixel 9","type":"Smartphone","volume_percent":null},"fetched_at":"2026-10-27T17:40:00Z"}
