{"schema_version":1,"source":"web","state":"paused","type":"track","title":"So Cold - Remix","artists":["Breaking Benjamin"],"artist":"Breaking Benjamin","album":"We Are Not Alone","album_artist":"Breaking Benjamin","track_number":1,"disc_number":1,"duration_ms":273440,"position_ms":108905,"uri":"spotify:track:4BJyt25nburVwbnESDeIc7","url":"https://open.spotify.com/track/4BJyt25nburVwbnESDeIc7","artwork_url":"https://i.scdn.co/image/ab67616d0000b2734500b37eb7046f29233099a0","isrc":"USHR10423001","explicit":true,"device":{"name":"MacBook Pro","type":"Computer","volume_percent":80},"fetched_at":"2026-10-27T17:40:00Z"}
