{"schema_version":1,"source":"web","state":"playing","type":"track","title":"Amazone","artists":["Alvan"],"artist":"Alvan","album":"Home","album_artist":"Alvan","track_number":null,"disc_number":null,"duration_ms":238000,"position_ms":12000,"uri":"spotify:local:Alvan:Home:Amazone:238","url":null,"artwork_url":null,"isrc":null,"explicit":false,"device":{"name":"MacBook Pro","type":"Computer","volume_percent":80},"fetched_at":"2026-10-27T17:40:00Z"}
