{"schema_version":1,"source":"mpris","state":"playing","type":"ad","title":"Advertisement","artists":[],"artist":null,"album":null,"album_artist":null,"track_number":null,"disc_number":null,"duration_ms":30000,"position_ms":null,"uri":"spotify:ad:0123456789abcdef0123456789abcdef","url":null,"artwork_url":null,"isrc":null,"explicit":null,"device":null,"fetched_at":"2026-10-27T17:40:00Z"}
