{"schema_version":1,"source":"macos","state":"playing","type":"track","title":"Line1\nLine2\tTab","artists":["A\r\nB"],"artist":"A\r\nB","album":"Al\u0007bum","album_artist":"Alvan","track_number":4,"disc_number":1,"duration_ms":2000,"position_ms":1000,"uri":"spotify:track:4brK3gpPjXArNUlU1hBXTe","url":"https://open.spotify.com/track/4brK3gpPjXArNUlU1hBXTe","artwork_url":"https://i.scdn.co/image/ab67616d0000b273a9ab54d90005cfd439f821e8","isrc":null,"explicit":null,"device":null,"fetched_at":"2026-10-27T17:40:00Z"}
