{"schema_version":1,"source":"web","state":"playing","type":"ad","title":null,"artists":[],"artist":null,"album":null,"album_artist":null,"track_number":null,"disc_number":null,"duration_ms":null,"position_ms":4500,"uri":null,"url":null,"artwork_url":null,"isrc":null,"explicit":null,"device":{"name":"Living Room","type":"Speaker","volume_percent":55},"fetched_at":"2026-10-27T17:40:00Z"}
