{"schema_version":1,"source":"macos","state":"playing","type":"ad","title":null,"artists":[],"artist":null,"album":null,"album_artist":null,"track_number":4,"disc_number":1,"duration_ms":30000,"position_ms":5000,"uri":"spotify:ad:000000000000","url":null,"artwork_url":null,"isrc":null,"explicit":null,"device":null,"fetched_at":"2026-10-27T17:40:00Z"}
