{"schema_version":1,"source":"mpris","state":"stopped","type":"unknown","title":null,"artists":[],"artist":null,"album":null,"album_artist":null,"track_number":null,"disc_number":null,"duration_ms":null,"position_ms":null,"uri":null,"url":null,"artwork_url":null,"isrc":null,"explicit":null,"device":null,"fetched_at":"2026-10-27T17:40:00Z"}
