{"schema_version":1,"source":"mpris","state":"playing","type":"track","title":"Amazone","artists":["Alvan"],"artist":"Alvan","album":"Home","album_artist":null,"track_number":4,"disc_number":1,"duration_ms":238341,"position_ms":null,"uri":null,"url":null,"artwork_url":null,"isrc":null,"explicit":null,"device":null,"fetched_at":"2026-10-27T17:40:00Z"}
