{"schema_version":1,"source":"macos","state":"playing","type":"track","title":"Amazone","artists":[],"artist":null,"album":"Home","album_artist":null,"track_number":4,"disc_number":1,"duration_ms":238341,"position_ms":120165,"uri":"spotify:track:4brK3gpPjXArNUlU1hBXTe","url":"https://open.spotify.com/track/4brK3gpPjXArNUlU1hBXTe","artwork_url":"https://i.scdn.co/image/ab67616d0000b273a9ab54d90005cfd439f821e8","isrc":null,"explicit":null,"device":null,"fetched_at":"2026-10-27T17:40:00Z"}
