{"schema_version":1,"source":"web","state":"paused","type":"track","title":"Blinding Lights","artists":["The Weeknd"],"artist":"The Weeknd","album":"After Hours","album_artist":"The Weeknd","track_number":4,"disc_number":1,"duration_ms":200040,"position_ms":61000,"uri":"spotify:track:4brK3gpPjXArNUlU1hBXTe","url":"https://open.spotify.com/track/4brK3gpPjXArNUlU1hBXTe","artwork_url":"https://i.scdn.co/image/ab67616d0000b273a9ab54d90005cfd439f821e8","isrc":"USUG11904206","explicit":false,"device":{"name":"Kitchen","type":"Speaker","volume_percent":40},"fetched_at":"2026-10-27T17:40:00Z"}
